{
  "action": "apply",
  "actor_id": "honua-devops:urn:honua:provisioning:00000000000000000000000000000000",
  "approved_digest": "058307fcb139d9c5c6eb4ed483bc244778972f12e5bf13e351f5e38d9113f4f2",
  "backend_step": {
    "backend_config_digest": "0ea699e4b738a98ed5c9a7ce497ad94b7922fe0d1e86c88e38ba5be3902036a3",
    "backend_kind": "s3",
    "bucket_arn": "arn:aws:s3:::honua-tfstate-fixture",
    "locking": {
      "detail": "honua/aws/dev/terraform.tfstate.tflock",
      "kind": "s3-native-lockfile"
    },
    "object_key": "honua/aws/dev/terraform.tfstate",
    "workspace": "default"
  },
  "candidate_digest": null,
  "cleanup": {
    "claim_dir": "/var/tmp/honua-devops-terraform-plans/fixture/honua.tfplan.claim",
    "saved_plan": "/var/tmp/honua-devops-terraform-plans/fixture/honua.tfplan",
    "teardown_action": "destroy",
    "teardown_root": "infrastructure/terraform/examples/aws"
  },
  "completed_at_utc": "2026-08-28T21:02:27Z",
  "evidence_scope": "metadata-only-post-execution",
  "exit_status": 0,
  "kind": "honua.iac.exec-receipt",
  "output_contract": {
    "digest": "faa15547bf0cbdf52d740e1e856cab5baf3513a4bf2a0ad53797057f47a9ffab",
    "output_name": "operator_contract_digest"
  },
  "plan_metadata_digest": "058307fcb139d9c5c6eb4ed483bc244778972f12e5bf13e351f5e38d9113f4f2",
  "saved_plan_sha256": "3a691c59f9c8be1eb1ce3e7642643a7aedfa7a0314c8d01750546ea83efca6fe",
  "schema_version": "v1",
  "state_after": {
    "lineage": "0a1b2c3d-4e5f-6071-8293-a4b5c6d7e8f9",
    "serial": 13
  },
  "state_before": {
    "lineage": "0a1b2c3d-4e5f-6071-8293-a4b5c6d7e8f9",
    "serial": 12
  },
  "status": "succeeded",
  "target_id": "aws-ecs:dev",
  "workload_identity": {
    "account_id": "123456789012",
    "assumed_role_arn": "arn:aws:sts::123456789012:assumed-role/honua-deploy-dev/session",
    "contract_digest": null,
    "credential_kind": "sts-assumed-role",
    "issuer": "https://token.actions.githubusercontent.com",
    "partition": "aws",
    "role_id": "AROAEXAMPLEID"
  }
}
